{
  "contract_version": "0.2.0",
  "run_id": "teesta__s007__sph",
  "scenario_id": "teesta__s007",
  "model": "sph",
  "status": "postprocessed",
  "solver_version": "5.4.355",
  "resolution_m": 10.0,
  "dp_m": 0.3,
  "particle_count": 0,
  "peak_vram_mb": 0.0,
  "sim_duration_s": 0.0,
  "wall_time_s": 0.0,
  "mass_balance_error_pct": 0.0,
  "thresholds": { "extent_m": 0.3, "arrival_m": 0.1 },
  "hydrographs": [],
  "resampling": "none -- MeasureTool interpolated directly at each near-field cell centre",
  "warnings": [],
  "caveats": ["clear_water", "fixed_area_inlet", "sph_arrival_below_resolution"],
  "has_placeholders": false,
  "placeholder_fields": [],
  "started_at": "2026-09-25T00:00:00Z",
  "finished_at": "2026-09-25T00:00:00Z"
}
